VNB-Name,Teilnetzgebiet,Bundesland,Ort / Trasse,Netzebene,Art der Maßnahme,Leitungslänge in km,Übertragungskapazität in MVA,"Netzkomponenten (z.B. UW,Trafo ;Anzahl/Typ)",Projektstatus,Zeithorizont,Kosten in Mio.€,location,latitude,longitude,passt
Avacon Netz,Ost,Sachsen-Anhalt,Schierke,HS,Erüchtigungen Leitungen,0.0,60.0,Leitung,NOVA,2045,0.01,"Schierke, Wernigerode, Landkreis Harz, Sachsen-Anhalt, 38879, Deutschland",51.7644243,10.6593718,True
Avacon Netz,Ost,Hessen,Fulda,HS,Erüchtigungen Leitungen,0.0,75.0,Leitung,NOVA,2045,0.01,"Fulda, Landkreis Fulda, Hessen, Deutschland",50.5542328,9.6770448,True
Avacon Netz,Ost,Niedersachsen,Conneforde,HS,Erüchtigungen Leitungen,0.0,72.0,Leitung,NOVA,2045,0.02,"Conneforde, Wiefelstede, Landkreis Ammerland, Niedersachsen, 26215, Deutschland",53.3257698,8.0577591,True
Avacon Netz,Ost,Sachsen-Anhalt,Stendal,HS,Erüchtigungen Leitungen,107.6,108.0,Leitung,NOVA,2045,0.02,"Stendal, Sachsen-Anhalt, 39576, Deutschland",52.6050782,11.8594279,True
Avacon Netz,Ost,Niedersachsen,Hattorf,HS,Erüchtigungen Leitungen,0.0,141.0,Leitung,NOVA,2045,0.02,"Hattorf, Wolfsburg, Niedersachsen, 38444, Deutschland",52.3600784,10.7463328,True
Avacon Netz,Ost,Sachsen-Anhalt,Staßfurt,HS,Erüchtigungen Leitungen,147.4,147.0,Leitung,NOVA,2045,0.02,"Staßfurt, Salzlandkreis, Sachsen-Anhalt, Deutschland",51.8514515,11.5929455,True
Avacon Netz,Ost,Sachsen-Anhalt,Demsin,HS,Erüchtigungen Leitungen,0.0,50.0,Leitung,NOVA,2045,0.03,"Demsin, Jerichow, Jerichower Land, Sachsen-Anhalt, Deutschland",52.4407157,12.2688698,True
Avacon Netz,Ost,Niedersachsen,Halbemond,HS,Erüchtigungen Leitungen,0.0,62.0,Leitung,NOVA,2045,0.03,"Halbemond, Samtgemeinde Hage, Landkreis Aurich, Niedersachsen, Deutschland",53.5658058,7.297287,True
Avacon Netz,Ost,Sachsen-Anhalt,Schwanebeck,HS,Erüchtigungen Leitungen,107.6,108.0,Leitung,NOVA,2045,0.03,"Schwanebeck, Vorharz, Landkreis Harz, Sachsen-Anhalt, 39397, Deutschland",51.9601208,11.1169263,True
Avacon Netz,Ost,Sachsen-Anhalt,Bernburg,HS,Erüchtigungen Leitungen,107.6,108.0,Leitung,NOVA,2045,0.03,"Bernburg, Salzlandkreis, Sachsen-Anhalt, 06406, Deutschland",51.7930788,11.7391606,True
Avacon Netz,Ost,Sachsen-Anhalt,Magdeburg,HS,Erüchtigungen Leitungen,147.4,147.0,Leitung,NOVA,2045,0.03,"Magdeburg, Sachsen-Anhalt, Deutschland",52.1315889,11.6399609,True
Avacon Netz,Ost,Niedersachsen,Bassum,HS,Erüchtigungen Leitungen,0.0,148.0,Leitung,NOVA,2045,0.03,"Bassum, Landkreis Diepholz, Niedersachsen, 27211, Deutschland",52.8495881,8.728382,True
Avacon Netz,Ost,Hessen,Waldkappel,HS,Erüchtigungen Leitungen,0.0,49.0,Leitung,NOVA,2045,0.04,"Waldkappel, Werra-Meißner-Kreis, Hessen, 37284, Deutschland",51.1351872,9.8568782,True
Avacon Netz,Ost,Niedersachsen,Cloppenburg,HS,Erüchtigungen Leitungen,0.0,62.0,Leitung,NOVA,2045,0.04,"Cloppenburg, Landkreis Cloppenburg, Niedersachsen, 49661, Deutschland",52.8461339,8.0438783,True
Avacon Netz,Ost,Niedersachsen,Cloppenburg,HS,Erüchtigungen Leitungen,0.0,62.0,Leitung,NOVA,2045,0.04,"Cloppenburg, Landkreis Cloppenburg, Niedersachsen, 49661, Deutschland",52.8461339,8.0438783,True
Avacon Netz,Ost,Niedersachsen,Poehlde,HS,Erüchtigungen Leitungen,0.0,62.0,Leitung,NOVA,2045,0.04,"Pöhlde, Herzberg am Harz, Landkreis Göttingen, Niedersachsen, 37412, Deutschland",51.6099889,10.3209272,True
Avacon Netz,Ost,Hessen,Asslar,HS,Erüchtigungen Leitungen,0.0,75.0,Leitung,NOVA,2045,0.04,"Aßlar, Lahn-Dill-Kreis, Hessen, 35614, Deutschland",50.609245,8.447572,True
Avacon Netz,Ost,Hessen,Ziegel,HS,Erüchtigungen Leitungen,0.0,78.0,Leitung,NOVA,2045,0.04,"Ziegel, Bronnzell, Fulda, Landkreis Fulda, Hessen, 36043, Deutschland",50.5098407,9.6657883,True
Avacon Netz,Ost,Niedersachsen,Helmstedt,HS,Erüchtigungen Leitungen,107.6,108.0,Leitung,NOVA,2045,0.04,"Helmstedt, Landkreis Helmstedt, Niedersachsen, Deutschland",52.2089226,11.0028882,True
Avacon Netz,Ost,Sachsen-Anhalt,Staßfurt,HS,Erüchtigungen Leitungen,107.6,108.0,Leitung,NOVA,2045,0.04,"Staßfurt, Salzlandkreis, Sachsen-Anhalt, Deutschland",51.8514515,11.5929455,True
Avacon Netz,Ost,Sachsen-Anhalt,Könnern,HS,Erüchtigungen Leitungen,107.6,108.0,Leitung,NOVA,2045,0.04,"Könnern, Salzlandkreis, Sachsen-Anhalt, Deutschland",51.6706514,11.7713656,True
Avacon Netz,Ost,Sachsen-Anhalt,Steinitz,HS,Erüchtigungen Leitungen,147.4,147.0,Leitung,NOVA,2045,0.04,"Steinitz, Salzwedel, Altmarkkreis Salzwedel, Sachsen-Anhalt, Deutschland",52.8255264,11.1148286,True
Avacon Netz,Ost,Niedersachsen,Nienburg,HS,Erüchtigungen Leitungen,0.0,156.0,Leitung,NOVA,2045,0.04,"Landkreis Nienburg/Weser, Niedersachsen, Deutschland",52.6487602,9.2578105,True
Avacon Netz,Ost,Niedersachsen,Langholt,HS,Erüchtigungen Leitungen,0.0,68.0,Leitung,NOVA,2045,0.05,"Langholt, Rhauderfehn, Landkreis Leer, Niedersachsen, 26817, Deutschland",53.1125614,7.5795045,True
Avacon Netz,Ost,Niedersachsen,Unterweser,HS,Erüchtigungen Leitungen,0.0,72.0,Leitung,NOVA,2045,0.05,"Unterweser, 2, Dedesdorfer Straße, Kleinensiel, Stadland, Landkreis Wesermarsch, Niedersachsen, 26935, Deutschland",53.4286009,8.4747049,True
Avacon Netz,Ost,Hessen,Hersfeld,HS,Erüchtigungen Leitungen,0.0,78.0,Leitung,NOVA,2045,0.05,"Bad Hersfeld, Landkreis Hersfeld-Rotenburg, Hessen, 36251, Deutschland",50.8604177,9.6767709,True
Avacon Netz,Ost,Sachsen-Anhalt,Wernigerode,HS,Erüchtigungen Leitungen,79.2,79.0,Leitung,NOVA,2045,0.05,"Wernigerode, Landkreis Harz, Sachsen-Anhalt, Deutschland",51.8344172,10.7862526,True
Avacon Netz,Ost,Sachsen-Anhalt,Oschersleben,HS,Erüchtigungen Leitungen,107.6,108.0,Leitung,NOVA,2045,0.05,"Oschersleben, Börde, Sachsen-Anhalt, 39387, Deutschland",52.0266526,11.227781,True
Avacon Netz,Ost,Sachsen-Anhalt,Genthin,HS,Erüchtigungen Leitungen,107.6,108.0,Leitung,NOVA,2045,0.05,"Genthin, Jerichower Land, Sachsen-Anhalt, 39307, Deutschland",52.4063738,12.1561742,True
Avacon Netz,Ost,Sachsen-Anhalt,Zerbst,HS,Erüchtigungen Leitungen,107.6,108.0,Leitung,NOVA,2045,0.05,"Zerbst, Zerbst/Anhalt, Anhalt-Bitterfeld, Sachsen-Anhalt, 39261, Deutschland",51.9697398,12.0745464,True
Avacon Netz,Ost,Sachsen-Anhalt,Alsleben,HS,Erüchtigungen Leitungen,107.6,108.0,Leitung,NOVA,2045,0.05,"Alsleben, Saale-Wipper, Salzlandkreis, Sachsen-Anhalt, Deutschland",51.7015251,11.6783936,True
Avacon Netz,Ost,Niedersachsen,Elze,HS,Erüchtigungen Leitungen,0.0,126.0,Leitung,NOVA,2045,0.05,"Elze, Landkreis Hildesheim, Niedersachsen, 31008, Deutschland",52.1190302,9.7369863,True
Avacon Netz,Ost,Niedersachsen,Delligsen,HS,Erüchtigungen Leitungen,0.0,126.0,Leitung,NOVA,2045,0.05,"Delligsen, Landkreis Holzminden, Niedersachsen, Deutschland",51.9429111,9.7985793,True
Avacon Netz,Ost,Sachsen-Anhalt,Halberstadt,HS,Erüchtigungen Leitungen,107.6,108.0,Leitung,NOVA,2045,0.06,"Halberstadt, Landkreis Harz, Sachsen-Anhalt, 38820, Deutschland",51.8953514,11.0520563,True
Avacon Netz,Ost,Sachsen-Anhalt,Oebisfelde,HS,Erüchtigungen Leitungen,107.6,108.0,Leitung,NOVA,2045,0.06,"Oebisfelde, Oebisfelde-Weferlingen, Börde, Sachsen-Anhalt, 39646, Deutschland",52.4294974,10.9872643,True
Avacon Netz,Ost,Sachsen-Anhalt,Schönebeck,HS,Erüchtigungen Leitungen,107.6,108.0,Leitung,NOVA,2045,0.06,"Schönebeck (Elbe), Salzlandkreis, Sachsen-Anhalt, Deutschland",52.0205998,11.7383277,True
Avacon Netz,Ost,Niedersachsen,Haselünne,HS,Erüchtigungen Leitungen,0.0,50.0,Leitung,NOVA,2045,0.07,"Haselünne, Landkreis Emsland, Niedersachsen, 49740, Deutschland",52.6718718,7.4830538,True
Avacon Netz,Ost,Sachsen-Anhalt,Ilsenburg,HS,Erüchtigungen Leitungen,107.6,107.0,Leitung,NOVA,2045,0.07,"Ilsenburg, Landkreis Harz, Sachsen-Anhalt, Deutschland",51.8667349,10.6831785,True
Avacon Netz,Ost,Sachsen-Anhalt,Möckern,HS,Erüchtigungen Leitungen,0.0,140.0,Leitung,NOVA,2045,0.07,"Möckern, Jerichower Land, Sachsen-Anhalt, Deutschland",52.1405163,11.9532769,True
Avacon Netz,Ost,Niedersachsen,Cuxhaven,HS,Erüchtigungen Leitungen,0.0,145.0,Leitung,NOVA,2045,0.07,"Cuxhaven, Landkreis Cuxhaven, Niedersachsen, Deutschland",53.86878,8.698286,True
Avacon Netz,Ost,Niedersachsen,Wieren,HS,Erüchtigungen Leitungen,0.0,150.0,Leitung,NOVA,2045,0.07,"Wieren, Wrestedt, Samtgemeinde Aue, Uelzen, Niedersachsen, Deutschland",52.888757,10.656827,True
Avacon Netz,Ost,Hessen,Dillenburg,HS,Erüchtigungen Leitungen,0.0,63.0,Leitung,NOVA,2045,0.08,"Dillenburg, Lahn-Dill-Kreis, Hessen, Deutschland",50.75211,8.31573,True
Avacon Netz,Ost,Sachsen-Anhalt,Osterweddingen,HS,Erüchtigungen Leitungen,107.6,107.0,Leitung,NOVA,2045,0.08,"Osterweddingen, Sülzetal, Börde, Sachsen-Anhalt, Deutschland",52.0432285,11.5802935,True
Avacon Netz,Ost,Sachsen-Anhalt,Sargstedt,HS,Erüchtigungen Leitungen,0.0,108.0,Leitung,NOVA,2045,0.08,"Sargstedt, Halberstadt, Landkreis Harz, Sachsen-Anhalt, Deutschland",51.9404801,10.9869092,True
Avacon Netz,Ost,Sachsen-Anhalt,Harbke,HS,Erüchtigungen Leitungen,107.6,108.0,Leitung,NOVA,2045,0.08,"Harbke, Obere Aller, Börde, Sachsen-Anhalt, Deutschland",52.18776,11.0483065,True
Avacon Netz,Ost,Sachsen-Anhalt,Möckern,HS,Erüchtigungen Leitungen,107.6,108.0,Leitung,NOVA,2045,0.08,"Möckern, Jerichower Land, Sachsen-Anhalt, Deutschland",52.1405163,11.9532769,True
Avacon Netz,Ost,Niedersachsen,Helmstedt,HS,Erüchtigungen Leitungen,0.0,170.0,Leitung,NOVA,2045,0.08,"Helmstedt, Landkreis Helmstedt, Niedersachsen, Deutschland",52.2089226,11.0028882,True
Avacon Netz,Ost,Sachsen-Anhalt,Gardelegen,HS,Erüchtigungen Leitungen,0.0,311.0,Leitung,NOVA,2045,0.08,"Gardelegen, Altmarkkreis Salzwedel, Sachsen-Anhalt, Deutschland",52.5269433,11.3927377,True
Avacon Netz,Ost,Niedersachsen,Elsfleth,HS,Erüchtigungen Leitungen,0.0,72.0,Leitung,NOVA,2045,0.09,"Elsfleth, Landkreis Wesermarsch, Niedersachsen, 26931, Deutschland",53.2357029,8.4571037,True
Avacon Netz,Ost,Sachsen-Anhalt,Gardelegen,HS,Erüchtigungen Leitungen,107.6,108.0,Leitung,NOVA,2045,0.09,"Gardelegen, Altmarkkreis Salzwedel, Sachsen-Anhalt, Deutschland",52.5269433,11.3927377,True
Avacon Netz,Ost,Sachsen,Moritzburg,HS,Erüchtigungen Leitungen,0.0,126.0,Leitung,NOVA,2045,0.09,"Moritzburg, Meißen, Sachsen, 01468, Deutschland",51.1592018,13.6819406,True
Avacon Netz,Ost,Niedersachsen,Hardegsen,HS,Erüchtigungen Leitungen,0.0,60.0,Leitung,NOVA,2045,0.1,"Hardegsen, Landkreis Northeim, Niedersachsen, 37181, Deutschland",51.6528043,9.8322034,True
Avacon Netz,Ost,Niedersachsen,Conneforde,HS,Erüchtigungen Leitungen,0.5,108.0,"Leitung, FLM",NOVA,2045,0.1,"Conneforde, Wiefelstede, Landkreis Ammerland, Niedersachsen, 26215, Deutschland",53.3257698,8.0577591,True
Avacon Netz,Ost,Sachsen-Anhalt,Abbenrode,HS,Erüchtigungen Leitungen,107.6,108.0,Leitung,NOVA,2045,0.1,"Abbenrode, Nordharz, Landkreis Harz, Sachsen-Anhalt, Deutschland",51.9321706,10.6432174,True
Avacon Netz,Ost,Niedersachsen,Stadorf,HS,Erüchtigungen Leitungen,0.0,148.0,Leitung,NOVA,2045,0.1,"Stadorf, Schwienau, Samtgemeinde Bevensen-Ebstorf, Uelzen, Niedersachsen, 29593, Deutschland",52.9919338,10.3956338,True
Avacon Netz,Ost,Niedersachsen,Varel,HS,Erüchtigungen Leitungen,0.0,62.0,Leitung,NOVA,2045,0.11,"Varel, Landkreis Friesland, Niedersachsen, 26316, Deutschland",53.395777,8.1372149,True
Avacon Netz,Ost,Sachsen-Anhalt,Gardelegen,HS,Erüchtigungen Leitungen,0.0,100.0,Leitung,NOVA,2045,0.12,"Gardelegen, Altmarkkreis Salzwedel, Sachsen-Anhalt, Deutschland",52.5269433,11.3927377,True
Avacon Netz,Ost,Sachsen-Anhalt,Salzwedel,HS,Erüchtigungen Leitungen,0.0,100.0,Leitung,NOVA,2045,0.12,"Salzwedel, Altmarkkreis Salzwedel, Sachsen-Anhalt, 29410, Deutschland",52.8528456,11.1539699,True
Avacon Netz,Ost,Sachsen-Anhalt,Oschersleben,HS,Erüchtigungen Leitungen,0.0,135.0,Leitung,NOVA,2045,0.12,"Oschersleben, Börde, Sachsen-Anhalt, 39387, Deutschland",52.0266526,11.227781,True
Avacon Netz,Ost,Sachsen-Anhalt,Arneburg,HS,Erüchtigungen Leitungen,0.0,311.0,Leitung,NOVA,2045,0.12,"Arneburg, Arneburg-Goldbeck, Stendal, Sachsen-Anhalt, Deutschland",52.674454,12.0035022,True
Avacon Netz,Ost,Niedersachsen,Sulingen,HS,Erüchtigungen Leitungen,0.0,122.0,Leitung,NOVA,2045,0.13,"Sulingen, Landkreis Diepholz, Niedersachsen, 27232, Deutschland",52.6828374,8.8018923,True
Avacon Netz,Ost,Sachsen-Anhalt,Kunrau,HS,Erüchtigungen Leitungen,0.0,160.0,Leitung,NOVA,2045,0.13,"Kunrau, Klötze, Altmarkkreis Salzwedel, Sachsen-Anhalt, Deutschland",52.5649769,11.0201002,True
Avacon Netz,Ost,Sachsen-Anhalt,Genthin,HS,Erüchtigungen Leitungen,0.0,100.0,Leitung,NOVA,2045,0.14,"Genthin, Jerichower Land, Sachsen-Anhalt, 39307, Deutschland",52.4063738,12.1561742,True
Avacon Netz,Ost,Niedersachsen,Ohlensehlen,HS,Erüchtigungen Leitungen,0.0,400.0,Leitung,NOVA,2045,0.15,"Woltringhausen, Ohlensehlen, Woltringhausen, Uchte, Samtgemeinde Uchte, Landkreis Nienburg/Weser, Niedersachsen, 31600, Deutschland",52.5556397,8.9084552,True
Avacon Netz,Ost,Niedersachsen,Wechold,HS,Erüchtigungen Leitungen,0.0,63.0,Leitung,NOVA,2045,0.18,"Wechold, Hilgermissen, Samtgemeinde Grafschaft Hoya, Landkreis Nienburg/Weser, Niedersachsen, Deutschland",52.8480963,9.1263681,True
Avacon Netz,Ost,Sachsen-Anhalt,Zerbst,HS,Erüchtigungen Leitungen,0.0,130.0,Leitung,NOVA,2045,0.18,"Zerbst, Zerbst/Anhalt, Anhalt-Bitterfeld, Sachsen-Anhalt, 39261, Deutschland",51.9697398,12.0745464,True
Avacon Netz,Ost,Niedersachsen,Peine/West,HS,Erüchtigungen Leitungen,0.0,204.0,Leitung,NOVA,2045,0.31,"Verkehrsbetriebe Peine-Salzgitter, Am Hillenholz, Heerte, Ortschaft West, Salzgitter, Niedersachsen, 38229, Deutschland",52.1461246,10.380243,True
Avacon Netz,Ost,Niedersachsen,Blexen,HS,Erüchtigungen Leitungen,0.0,83.0,Leitung,NOVA,2045,0.34,"Blexen, Nordenham, Landkreis Wesermarsch, Niedersachsen, 27568, Deutschland",53.53237,8.535242,True
Avacon Netz,Ost,Niedersachsen,Ganderkesee,HS,Erüchtigungen UW,0.0,300.0,UW,NOVA,2045,0.4,"Ganderkesee, Landkreis Oldenburg, Niedersachsen, 27777, Deutschland",53.0344984,8.5451469,True
Avacon Netz,Ost,Niedersachsen,Lehrte,HS,Neubau UW,0.0,300.0,"UW, Leitung",NOVA,2045,1.0,"Lehrte, Region Hannover, Niedersachsen, 31275, Deutschland",52.3749334,9.9748557,True
Avacon Netz,Ost,Sachsen-Anhalt,Osterburg,HS,Erüchtigungen UW,0.0,300.0,UW,NOVA,2045,1.0,"Osterburg, Osterburg (Altmark), Stendal, Sachsen-Anhalt, 39606, Deutschland",52.7899044,11.7526038,True
Avacon Netz,Ost,Niedersachsen,Helmstedt,HS,Erüchtigungen UW,0.0,300.0,UW,NOVA,2045,1.0,"Helmstedt, Landkreis Helmstedt, Niedersachsen, Deutschland",52.2089226,11.0028882,True
Avacon Netz,Ost,Nordrhein-Westfalen,Elsen,HS,Erüchtigungen Leitungen,0.0,125.0,Leitung,NOVA,2045,1.4,"Elsen, Paderborn, Kreis Paderborn, Nordrhein-Westfalen, 33106, Deutschland",51.7353263,8.6869145,True
Avacon Netz,Ost,Niedersachsen,Sulingen,HS,Erüchtigungen UW,0.0,0.0,"UW, Leitung",NOVA,2045,1.8,"Sulingen, Landkreis Diepholz, Niedersachsen, 27232, Deutschland",52.6828374,8.8018923,True
Avacon Netz,Ost,Hessen,Frankfurt,HS,Erüchtigungen UW,0.0,0.0,UW,NOVA,2045,1.9,"Frankfurt am Main, Hessen, Deutschland",50.1106444,8.6820917,True
Avacon Netz,Ost,Niedersachsen,Papenburg,HS,Erüchtigungen Leitungen,0.0,124.0,Leitung,NOVA,2045,1.99,"Papenburg, Landkreis Emsland, Niedersachsen, 26871, Deutschland",53.0822606,7.3928398,True
Avacon Netz,Ost,Hessen,Alsfeld,HS,Erüchtigungen Leitungen,0.0,104.0,Leitung,NOVA,2045,2.0,"Alsfeld, Vogelsbergkreis, Hessen, 36304, Deutschland",50.7523545,9.268355,True
Avacon Netz,Ost,Niedersachsen,Ohlensehlen,HS,Erüchtigungen UW,0.0,300.0,UW,NOVA,2045,2.0,"Woltringhausen, Ohlensehlen, Woltringhausen, Uchte, Samtgemeinde Uchte, Landkreis Nienburg/Weser, Niedersachsen, 31600, Deutschland",52.5556397,8.9084552,True
Avacon Netz,Ost,Niedersachsen,Peine/Ost,HS,Erüchtigungen Leitungen,0.0,126.0,Leitung,NOVA,2045,2.16,"Peine-Ost, A 2, Essinghausen, Peine, Landkreis Peine, Niedersachsen, 31224, Deutschland",52.3364261,10.2613656,True
Avacon Netz,Ost,Hessen,Niestetal,HS,Erüchtigungen Leitungen,0.0,197.0,Leitung,NOVA,2045,2.19,"Niestetal, Landkreis Kassel, Hessen, 34266, Deutschland",51.3186979,9.586191,True
Avacon Netz,Ost,Niedersachsen,Hänigsen,HS,Neubau Kompensationsspule,0.0,70.0,UW,NOVA,2045,2.2,"Hänigsen, Uetze, Region Hannover, Niedersachsen, Deutschland",52.4835828,10.0970197,True
Avacon Netz,Ost,Niedersachsen,Haverlahwiese,HS,Neubau Kompensationsspule,0.0,70.0,UW,NOVA,2045,2.2,"Haverlahwiese, Gebhardshagen, Ortschaft West, Salzgitter, Niedersachsen, 38229, Deutschland",52.1058068,10.3174253,True
Avacon Netz,Ost,Sachsen-Anhalt,Hüttenrode,HS,Neubau Kompensationsspule,0.0,70.0,UW,NOVA,2045,2.2,"Hüttenrode, Blankenburg, Landkreis Harz, Sachsen-Anhalt, Deutschland",51.773392,10.8822924,True
Avacon Netz,Ost,Niedersachsen,Homfeld,HS,Erüchtigungen Leitungen,0.5,194.0,"Leitung, FLM",NOVA,2045,2.22,"Homfeld, Bruchhausen-Vilsen, Samtgemeinde Bruchhausen-Vilsen, Landkreis Diepholz, Niedersachsen, Deutschland",52.8101571,8.9962989,True
Avacon Netz,Ost,Sachsen-Anhalt,Kunrau,HS,Erüchtigungen UW,0.0,0.0,UW,NOVA,2045,2.52,"Kunrau, Klötze, Altmarkkreis Salzwedel, Sachsen-Anhalt, Deutschland",52.5649769,11.0201002,True
Avacon Netz,Ost,Niedersachsen,Sottrum,HS,Neubau Kompensationsspule,0.0,70.0,UW,NOVA,2045,2.67,"Sottrum, Samtgemeinde Sottrum, Landkreis Rotenburg (Wümme), Niedersachsen, Deutschland",53.1161752,9.2354374,True
Avacon Netz,Ost,Niedersachsen,Hänigsen,HS,Erüchtigungen Leitungen,0.0,174.0,Leitung,NOVA,2045,2.74,"Hänigsen, Uetze, Region Hannover, Niedersachsen, Deutschland",52.4835828,10.0970197,True
Avacon Netz,Ost,Niedersachsen,Bostel,HS,Erüchtigungen Leitungen,0.0,170.0,Leitung,NOVA,2045,2.92,"Bostel, Celle, Landkreis Celle, Niedersachsen, Deutschland",52.6462181,10.134043,True
Avacon Netz,Ost,Niedersachsen,Hildesheim,HS,Erüchtigungen Leitungen,0.0,126.0,Leitung,NOVA,2045,2.96,"Hildesheim, Landkreis Hildesheim, Niedersachsen, Deutschland",52.1527188,9.9518083,True
Avacon Netz,Ost,Hessen,Niedermittlau,HS,Erüchtigungen Leitungen,0.0,130.0,Leitung,NOVA,2045,3.0,"Niedermittlau, Hasselroth, Main-Kinzig-Kreis, Hessen, Deutschland",50.1696544,9.1262328,True
Avacon Netz,Ost,Niedersachsen,Hannover,HS,Erüchtigungen Leitungen,0.0,150.0,Leitung,NOVA,2045,3.08,"Hannover, Region Hannover, Niedersachsen, Deutschland",52.3744779,9.7385532,True
Avacon Netz,Ost,Hessen,Niedermittlau,HS,Erüchtigungen Leitungen,0.0,104.0,Leitung,NOVA,2045,3.2,"Niedermittlau, Hasselroth, Main-Kinzig-Kreis, Hessen, Deutschland",50.1696544,9.1262328,True
Avacon Netz,Ost,Niedersachsen,Hildesheim,HS,Erüchtigungen Leitungen,0.0,150.0,Leitung,NOVA,2045,3.22,"Hildesheim, Landkreis Hildesheim, Niedersachsen, Deutschland",52.1527188,9.9518083,True
Avacon Netz,Ost,Niedersachsen,Clenze,HS,Erüchtigungen Leitungen,0.0,150.0,Leitung,NOVA,2045,3.26,"Clenze, Samtgemeinde Lüchow (Wendland), Lüchow-Dannenberg, Niedersachsen, 29459, Deutschland",52.951749,10.9343479,True
Avacon Netz,Ost,Niedersachsen,Vechelde,HS,Erüchtigungen Leitungen,0.0,150.0,Leitung,NOVA,2045,3.32,"Vechelde, Landkreis Peine, Niedersachsen, 38159, Deutschland",52.2608949,10.3694118,True
Avacon Netz,Ost,Sachsen-Anhalt,Stendal,HS,Erüchtigungen Leitungen,0.0,311.0,Leitung,NOVA,2045,3.47,"Stendal, Sachsen-Anhalt, 39576, Deutschland",52.6050782,11.8594279,True
Avacon Netz,Ost,Hessen,Wächtersbach,HS,Erüchtigungen UW,0.0,0.0,UW,NOVA,2045,3.5,"Wächtersbach, Main-Kinzig-Kreis, Hessen, 63607, Deutschland",50.2724,9.2857,True
Avacon Netz,Ost,Hessen,Merkenbach,HS,Erüchtigungen Leitungen,0.0,21.0,Leitung,NOVA,2045,3.52,"Merkenbach, Herborn, Lahn-Dill-Kreis, Hessen, Deutschland",50.6568689,8.2979789,True
Avacon Netz,Ost,Niedersachsen,Salzgitter,HS,Erüchtigungen UW,0.0,0.0,UW,NOVA,2045,3.55,"Salzgitter, Niedersachsen, Deutschland",52.1503721,10.3593147,True
Avacon Netz,Ost,Hessen,Dipperz,HS,Neubau Kompensationsspule,0.0,0.0,UW,NOVA,2045,3.7,"Dipperz, Landkreis Fulda, Hessen, 36160, Deutschland",50.5425735,9.7967941,True
Avacon Netz,Ost,Hessen,Gießen,HS,Neubau Kompensationsspule,0.0,0.0,UW,NOVA,2045,3.7,"Gießen, Landkreis Gießen, Hessen, Deutschland",50.5808795,8.6938161,True
Avacon Netz,Ost,Niedersachsen,Godenau,HS,Erüchtigungen Leitungen,0.0,107.0,Leitung,NOVA,2045,3.84,"Godenau, Alfeld (Leine), Landkreis Hildesheim, Niedersachsen, 31061, Deutschland",52.010037,9.7882273,True
Avacon Netz,Ost,Niedersachsen,Gadenstedt,HS,Erüchtigungen Leitungen,0.0,130.0,Leitung,NOVA,2045,3.96,"Gadenstedt, Ilsede, Landkreis Peine, Niedersachsen, 31246, Deutschland",52.2449459,10.2190017,True
Avacon Netz,Ost,Hessen,Karben,HS,Neubau Leitungen,0.0,0.0,Leitung,NOVA,2045,4.25,"Karben, Wetteraukreis, Hessen, 61184, Deutschland",50.2313417,8.7717673,True
Avacon Netz,Ost,Niedersachsen,Ilsede,HS,Erüchtigungen Leitungen,0.0,150.0,Leitung,NOVA,2045,4.32,"Ilsede, Landkreis Peine, Niedersachsen, Deutschland",52.2602378,10.2155251,True
Avacon Netz,Ost,Hessen,Niedermittlau,HS,Erüchtigungen Leitungen,0.0,25.0,Leitung,NOVA,2045,4.4,"Niedermittlau, Hasselroth, Main-Kinzig-Kreis, Hessen, Deutschland",50.1696544,9.1262328,True
Avacon Netz,Ost,Niedersachsen,Peine,HS,Erüchtigungen Leitungen,0.0,150.0,Leitung,NOVA,2045,4.43,"Landkreis Peine, Niedersachsen, Deutschland",52.3117289,10.251904,True
Avacon Netz,Ost,Hessen,Wächtersbach,HS,Erüchtigungen Leitungen,0.0,42.0,Leitung,NOVA,2045,4.6,"Wächtersbach, Main-Kinzig-Kreis, Hessen, 63607, Deutschland",50.2724,9.2857,True
Avacon Netz,Ost,Sachsen-Anhalt,Seehausen,HS,Neubau UW,0.0,80.0,UW,NOVA,2045,4.6,"Seehausen (Altmark), Seehausen, Stendal, Sachsen-Anhalt, 39615, Deutschland",52.8888609,11.7519908,True
Avacon Netz,Ost,Niedersachsen,Fallersleben,HS,Erüchtigungen Leitungen,0.0,236.0,Leitung,NOVA,2045,5.0,"Fallersleben, Wolfsburg, Niedersachsen, 38442, Deutschland",52.4190578,10.7187346,True
Avacon Netz,Ost,Sachsen-Anhalt,Zerbst,HS,Neubau UW,0.0,240.0,"UW, Leitung",NOVA,2045,5.0,"Zerbst, Zerbst/Anhalt, Anhalt-Bitterfeld, Sachsen-Anhalt, 39261, Deutschland",51.9697398,12.0745464,True
Avacon Netz,Ost,Niedersachsen,Rethen,HS,Erüchtigungen Leitungen,0.0,168.0,Leitung,NOVA,2045,5.19,"Rethem (Aller), Samtgemeinde Rethem/Aller, Heidekreis, Niedersachsen, 27336, Deutschland",52.7834554,9.3780422,True
Avacon Netz,Ost,Sachsen-Anhalt,Steinitz,HS,Erüchtigungen Leitungen,0.0,597.0,Leitung,NOVA,2045,5.36,"Steinitz, Salzwedel, Altmarkkreis Salzwedel, Sachsen-Anhalt, Deutschland",52.8255264,11.1148286,True
Avacon Netz,Ost,Niedersachsen,Garrel,HS,Erüchtigungen Leitungen,0.0,294.0,Leitung,NOVA,2045,5.41,"Garrel, Landkreis Cloppenburg, Niedersachsen, 49681, Deutschland",52.9554303,8.0225529,True
Avacon Netz,Ost,Niedersachsen,Hildesheim,HS,Erüchtigungen Leitungen,0.0,97.0,Leitung,NOVA,2045,5.61,"Hildesheim, Landkreis Hildesheim, Niedersachsen, Deutschland",52.1527188,9.9518083,True
Avacon Netz,Ost,Hessen,Großkrotzenburg,HS,Erüchtigungen UW,0.0,0.0,UW,NOVA,2045,6.2,"Großkrotzenburg, Main-Kinzig-Kreis, Hessen, 63538, Deutschland",50.0826406,8.9837384,True
Avacon Netz,Ost,Niedersachsen,Simmerhausen,HS,Neubau UW,0.0,126.0,UW,NOVA,2045,6.28,"Simmerhausen, Prinzhöfte, Samtgemeinde Harpstedt, Landkreis Oldenburg, Niedersachsen, 27243, Deutschland",52.933339,8.4809286,True
Avacon Netz,Ost,Sachsen-Anhalt,Jeeben,HS,Erüchtigungen UW,0.0,40.0,Schaltanlage,NOVA,2045,6.5,"Jeeben, Beetzendorf, Beetzendorf-Diesdorf, Altmarkkreis Salzwedel, Sachsen-Anhalt, Deutschland",52.682155,11.0906519,True
Avacon Netz,Ost,Niedersachsen,Niederlangen,HS,Erüchtigungen Leitungen,0.0,62.0,Leitung,NOVA,2045,6.5,"Niederlangen, Samtgemeinde Lathen, Landkreis Emsland, Niedersachsen, 49779, Deutschland",52.8572175,7.2805369,True
Avacon Netz,Ost,Hessen,Neuhof,HS,Erüchtigungen Leitungen,0.0,75.0,Leitung,NOVA,2045,6.57,"Neuhof, Landkreis Fulda, Hessen, 36119, Deutschland",50.4837077,9.6002656,True
Avacon Netz,Ost,Nordrhein-Westfalen,Elsen,HS,Erüchtigungen Leitungen,0.0,125.0,Leitung,NOVA,2045,6.57,"Elsen, Paderborn, Kreis Paderborn, Nordrhein-Westfalen, 33106, Deutschland",51.7353263,8.6869145,True
Avacon Netz,Ost,Sachsen-Anhalt,Bismark,HS,Erüchtigungen UW,0.0,80.0,Schaltanlage,NOVA,2045,6.6,"Bismark (Altmark), Stendal, Sachsen-Anhalt, Deutschland",52.6443959,11.6251053,True
Avacon Netz,Ost,Hessen,Melsungen,HS,Erüchtigungen Leitungen,0.0,117.0,Leitung,NOVA,2045,6.8,"Melsungen, Schwalm-Eder-Kreis, Hessen, 34212, Deutschland",51.1425944,9.5833158,True
Avacon Netz,Ost,Hessen,Büdingen,HS,Erüchtigungen Leitungen,0.0,104.0,Leitung,NOVA,2045,7.0,"Büdingen, Wetteraukreis, Hessen, 63654, Deutschland",50.2972353,9.0990829,True
Avacon Netz,Ost,Sachsen-Anhalt,Späningen,HS,Erüchtigungen UW,0.0,80.0,UW,NOVA,2045,7.18,"Späningen, Meßdorf, Bismark (Altmark), Stendal, Sachsen-Anhalt, Deutschland",52.7358566,11.5756034,True
Avacon Netz,Ost,Hessen,Waldkappel,HS,Erüchtigungen Leitungen,0.0,90.0,Leitung,NOVA,2045,7.2,"Waldkappel, Werra-Meißner-Kreis, Hessen, 37284, Deutschland",51.1351872,9.8568782,True
Avacon Netz,Ost,Niedersachsen,Nienburg,HS,Erüchtigungen Leitungen,0.0,206.0,Leitung,NOVA,2045,7.4,"Landkreis Nienburg/Weser, Niedersachsen, Deutschland",52.6487602,9.2578105,True
Avacon Netz,Ost,Niedersachsen,Werlte,HS,Neubau Schaltanlage,0.0,0.0,"UW, Leitung",NOVA,2045,7.41,"Werlte, Samtgemeinde Werlte, Landkreis Emsland, Niedersachsen, 49757, Deutschland",52.8518701,7.6764179,True
Avacon Netz,Ost,Niedersachsen,Stadorf,HS,Erüchtigungen Leitungen,0.0,204.0,Leitung,NOVA,2045,7.46,"Stadorf, Schwienau, Samtgemeinde Bevensen-Ebstorf, Uelzen, Niedersachsen, 29593, Deutschland",52.9919338,10.3956338,True
Avacon Netz,Ost,Niedersachsen,Wolfsburg,HS,Erüchtigungen Leitungen,0.0,518.0,Leitung,NOVA,2045,7.53,"Wolfsburg, Niedersachsen, Deutschland",52.4205588,10.7861682,True
Avacon Netz,Ost,Niedersachsen,Oldau,HS,Erüchtigungen Leitungen,0.0,170.0,Leitung,NOVA,2045,7.76,"Oldau, Hambühren, Landkreis Celle, Niedersachsen, 29313, Deutschland",52.6592868,9.9321181,True
Avacon Netz,Ost,Niedersachsen,Heerte,HS,Neubau UW,0.0,0.0,UW,NOVA,2045,8.0,"Heerte, Ortschaft West, Salzgitter, Niedersachsen, Deutschland",52.1246408,10.3880578,True
Avacon Netz,Ost,Hessen,Hanau,HS,Erüchtigungen UW,0.0,0.0,UW,NOVA,2045,8.0,"Hanau, Main-Kinzig-Kreis, Hessen, Deutschland",50.132881,8.9169797,True
